{
    "benchmarks": [
        {
            "name": "hwnoise",
            "ids": "1",
            "mv-params": {
                "global-options": [
                    {
                        "name": "common-params",
                        "params": [
			    { "arg": "duration", "vals": [ "10" ], "role": "client" },
                            { "arg": "smt", "vals": [ "off" ], "role": "client" }
                        ]
                    }
                ],
                "sets": [
                    {
                        "include": "common-params"
                    }
                ]
            }
        }
    ],
    "tool-params": [
        {
            "tool": "sysstat"
        },
        {
            "tool": "procstat"
        },
        {
            "tool": "kernel",
            "params": [
                {
                    "arg": "subtools",
                    "val": "turbostat"
                }
            ]
        },
        {
            "tool": "forkstat"
        }
    ],
    "tags": {
        "description": "hwnoise-kube-run-file-json"
    },
    "endpoints": [
        {
            "type": "kube",
            "controller-ip-address": "CONTROLLER_IP",
            "host": "CI_ENDPOINT_HOST",
            "user": "CI_ENDPOINT_USER",
	    "engines": {
		"client": 1
	    },
            "config": [
                {
                    "targets": [
                        { "role": "client", "ids": 1 }
                    ],
                    "settings": {
                        "securityContext": {
                            "container": {
                                "privileged": true
                            }
                        }
                    }
                },
                {
                    "targets": "default",
                    "settings": {
                        "cpu-partitioning": true
                    }
                }
            ]
        }
    ],
    "run-params": {
	"num-samples": 1,
	"test-order": "s"
    }
}
