{
    "benchmarks": [
        {
            "name": "stream",
            "ids": "1",
            "mv-params": {
                "global-options": [
                    {
                        "name": "ci-representative",
                        "params": [
                            { "arg": "test-type", "vals": [ "triad" ] },
                            { "arg": "threads", "vals": [ "1" ] },
                            { "arg": "array-mib", "vals": [ "256" ] },
                            { "arg": "cpu-node", "vals": [ "none" ] },
                            { "arg": "memory-node", "vals": [ "none" ] },
                            { "arg": "deadline", "vals": [ "300" ] }
                        ]
                    }
                ],
                "sets": [
                    { "include": "ci-representative" }
                ]
            }
        }
    ],
    "tool-params": [
        { "tool": "sysstat" },
        { "tool": "procstat" },
        {
            "tool": "kernel",
            "params": [
                { "arg": "subtools", "val": "turbostat" }
            ]
        },
        { "tool": "forkstat" }
    ],
    "tags": {
        "description": "stream-kube-ci-run-file-json"
    },
    "endpoints": [
        {
            "type": "kube",
            "controller-ip-address": "CONTROLLER_IP",
            "host": "CI_ENDPOINT_HOST",
            "user": "CI_ENDPOINT_USER",
            "engines": {
                "client": "1"
            },
            "config": [
                {
                    "targets": "default",
                    "settings": {
                        "cpu-partitioning": false
                    }
                }
            ]
        }
    ],
    "run-params": {
        "num-samples": 1,
        "test-order": "s"
    }
}
